{
  "meta": {
    "id": "edge-cases",
    "title": "エッジケース検証",
    "version": "0.1.0"
  },
  "state": {
    "customer": {
      "description": "顧客",
      "fields": {
        "id": {
          "type": "string",
          "required": true
        },
        "name": {
          "type": "string",
          "required": true
        },
        "tier": {
          "type": {
            "enum": [
              "bronze",
              "silver",
              "gold",
              "platinum"
            ]
          },
          "required": true
        },
        "credit_limit": {
          "type": "int",
          "required": true
        },
        "created_at": {
          "type": "datetime",
          "required": true
        }
      }
    },
    "order": {
      "description": "注文",
      "fields": {
        "id": {
          "type": "string",
          "required": true
        },
        "customer_id": {
          "type": {
            "ref": "customer"
          },
          "required": true
        },
        "status": {
          "type": {
            "enum": [
              "draft",
              "pending",
              "confirmed",
              "shipped",
              "delivered",
              "cancelled"
            ]
          },
          "required": true
        },
        "total_amount": {
          "type": "int",
          "required": true
        },
        "discount_rate": {
          "type": "float",
          "required": false
        },
        "ordered_at": {
          "type": "datetime",
          "required": false
        },
        "shipped_at": {
          "type": "datetime",
          "required": false
        },
        "delivered_at": {
          "type": "datetime",
          "required": false
        }
      }
    },
    "order_item": {
      "description": "注文明細",
      "fields": {
        "id": {
          "type": "string",
          "required": true
        },
        "order_id": {
          "type": {
            "ref": "order"
          },
          "required": true
        },
        "product_id": {
          "type": {
            "ref": "product"
          },
          "required": true
        },
        "quantity": {
          "type": "int",
          "required": true
        },
        "unit_price": {
          "type": "int",
          "required": true
        },
        "status": {
          "type": {
            "enum": [
              "active",
              "cancelled"
            ]
          },
          "required": true
        }
      }
    },
    "product": {
      "description": "商品",
      "fields": {
        "id": {
          "type": "string",
          "required": true
        },
        "name": {
          "type": "string",
          "required": true
        },
        "price": {
          "type": "int",
          "required": true
        },
        "stock": {
          "type": "int",
          "required": true
        },
        "category": {
          "type": "string",
          "required": true
        },
        "is_active": {
          "type": "bool",
          "required": true
        }
      }
    }
  },
  "derived": {
    "order_subtotal": {
      "entity": "order",
      "description": "注文小計（明細合計）",
      "returns": "int",
      "formula": {
        "type": "agg",
        "op": "sum",
        "from": "order_item",
        "as": "item",
        "expr": {
          "type": "binary",
          "op": "mul",
          "left": {
            "type": "ref",
            "path": "item.quantity"
          },
          "right": {
            "type": "ref",
            "path": "item.unit_price"
          }
        },
        "where": {
          "type": "binary",
          "op": "and",
          "left": {
            "type": "binary",
            "op": "eq",
            "left": {
              "type": "ref",
              "path": "item.order_id"
            },
            "right": {
              "type": "self",
              "field": "id"
            }
          },
          "right": {
            "type": "binary",
            "op": "eq",
            "left": {
              "type": "ref",
              "path": "item.status"
            },
            "right": {
              "type": "literal",
              "value": "active"
            }
          }
        }
      }
    },
    "order_discount_amount": {
      "entity": "order",
      "description": "割引額（CASE式：顧客ティアによる）",
      "returns": "int",
      "formula": {
        "type": "case",
        "branches": [
          {
            "when": {
              "type": "binary",
              "op": "eq",
              "left": {
                "type": "ref",
                "path": "order.customer.tier"
              },
              "right": {
                "type": "literal",
                "value": "platinum"
              }
            },
            "then": {
              "type": "binary",
              "op": "mul",
              "left": {
                "type": "call",
                "name": "order_subtotal",
                "args": [
                  {
                    "type": "self",
                    "field": ""
                  }
                ]
              },
              "right": {
                "type": "literal",
                "value": 0.2
              }
            }
          },
          {
            "when": {
              "type": "binary",
              "op": "eq",
              "left": {
                "type": "ref",
                "path": "order.customer.tier"
              },
              "right": {
                "type": "literal",
                "value": "gold"
              }
            },
            "then": {
              "type": "binary",
              "op": "mul",
              "left": {
                "type": "call",
                "name": "order_subtotal",
                "args": [
                  {
                    "type": "self",
                    "field": ""
                  }
                ]
              },
              "right": {
                "type": "literal",
                "value": 0.15
              }
            }
          },
          {
            "when": {
              "type": "binary",
              "op": "eq",
              "left": {
                "type": "ref",
                "path": "order.customer.tier"
              },
              "right": {
                "type": "literal",
                "value": "silver"
              }
            },
            "then": {
              "type": "binary",
              "op": "mul",
              "left": {
                "type": "call",
                "name": "order_subtotal",
                "args": [
                  {
                    "type": "self",
                    "field": ""
                  }
                ]
              },
              "right": {
                "type": "literal",
                "value": 0.1
              }
            }
          }
        ],
        "else": {
          "type": "literal",
          "value": 0
        }
      }
    },
    "order_final_amount": {
      "entity": "order",
      "description": "最終金額（小計 - 割引）",
      "returns": "int",
      "formula": {
        "type": "binary",
        "op": "sub",
        "left": {
          "type": "call",
          "name": "order_subtotal",
          "args": [
            {
              "type": "self",
              "field": ""
            }
          ]
        },
        "right": {
          "type": "call",
          "name": "order_discount_amount",
          "args": [
            {
              "type": "self",
              "field": ""
            }
          ]
        }
      }
    },
    "customer_total_orders": {
      "entity": "customer",
      "description": "顧客の注文総数",
      "returns": "int",
      "formula": {
        "type": "agg",
        "op": "count",
        "from": "order",
        "where": {
          "type": "binary",
          "op": "and",
          "left": {
            "type": "binary",
            "op": "eq",
            "left": {
              "type": "ref",
              "path": "item.customer_id"
            },
            "right": {
              "type": "self",
              "field": "id"
            }
          },
          "right": {
            "type": "binary",
            "op": "ne",
            "left": {
              "type": "ref",
              "path": "item.status"
            },
            "right": {
              "type": "literal",
              "value": "cancelled"
            }
          }
        }
      }
    },
    "customer_total_spent": {
      "entity": "customer",
      "description": "顧客の累計購入額（3段ネスト：顧客→注文→derived）",
      "returns": "int",
      "formula": {
        "type": "agg",
        "op": "sum",
        "from": "order",
        "as": "o",
        "expr": {
          "type": "call",
          "name": "order_final_amount",
          "args": [
            {
              "type": "ref",
              "path": "o"
            }
          ]
        },
        "where": {
          "type": "binary",
          "op": "and",
          "left": {
            "type": "binary",
            "op": "eq",
            "left": {
              "type": "ref",
              "path": "o.customer_id"
            },
            "right": {
              "type": "self",
              "field": "id"
            }
          },
          "right": {
            "type": "binary",
            "op": "eq",
            "left": {
              "type": "ref",
              "path": "o.status"
            },
            "right": {
              "type": "literal",
              "value": "delivered"
            }
          }
        }
      }
    },
    "customer_available_credit": {
      "entity": "customer",
      "description": "利用可能与信枠（与信限度額 - 未払い注文額）",
      "returns": "int",
      "formula": {
        "type": "binary",
        "op": "sub",
        "left": {
          "type": "self",
          "field": "credit_limit"
        },
        "right": {
          "type": "agg",